id_producto,producto,categoria
1,Alfonso y asociados S.Com. AT-056,Alimentos
2,Transportes Internacionales S.Com. YJ-242,Alimentos
3,Bello y Soto S.L.L. vZ-892,Deportes
4,Edelmiro Mas Aragonés S.L.L. Iu-503,Deportes
5,Tiburcio Duque Peñalver S.L.N.E OA-481,Ropa
6,Instalaciones Ibéricos S.L. Qy-680,Deportes
7,Logística del Levante S.A.T. Wj-101,Electrónica
8,Carmela Pi Mínguez S.A. Ws-930,Deportes
9,Colom y asociados S.Coop. dn-867,Hogar
10,Morán y Ribera S.A. qt-363,Electrónica
11,Fábrica Jordá y asociados S.Coop. og-963,Alimentos
12,Despacho LW S.Com. oh-707,Ropa
13,Marcial Losada Palau S.Coop. iy-626,Electrónica
14,Servicios del Norte S.Coop. JM-089,Electrónica
15,Odalys Valcárcel Landa S.L. Rs-594,Alimentos
16,Instalaciones Internacionales S.A. VD-537,Electrónica
17,Banca Privada Heredia y asociados S.Com. sb-687,Alimentos
18,Despacho Alsina y asociados S.Com. MC-514,Electrónica
19,Folch y asociados S.A. PX-573,Electrónica
20,Comercial Castellana S.L. Vc-094,Deportes
21,Peralta y Puig S.Com. Vs-823,Electrónica
22,Manufacturas Hidalgo y asociados S.L. vl-653,Deportes
23,Desarrollo del Noroeste S.Com. qD-000,Electrónica
24,Familia Becerra S.A. WQ-349,Electrónica
25,Robles & Asociados S.A. LV-989,Hogar
26,Miralles y Bernat S.A. nV-158,Deportes
27,Mirta Lloret Querol S.Com. CB-447,Electrónica
28,Soluciones ZALM S.Com. TN-682,Hogar
29,Hermanos Cañas S.Com. xb-599,Deportes
30,Inmobiliaria IMML S.Coop. sb-276,Ropa
31,Lobo y asociados S.L. lj-986,Ropa
32,Infraestructuras SL S.A. tF-660,Hogar
33,Supermercados Hervia & Asociados S.Coop. UV-147,Electrónica
34,Diez y asociados S.Coop. mu-420,Deportes
35,Instalaciones Calderón & Asociados S.L.N.E EP-238,Deportes
36,Minería Española S.Coop. FE-664,Deportes
37,Construcción Frías & Asociados S.L.N.E Rm-518,Ropa
38,Grupo Padilla S.Coop. Xu-346,Alimentos
39,Minería XW S.L. FJ-521,Alimentos
40,Nuñez & Asociados S.L.L. kJ-841,Hogar
41,Murillo y Paniagua S.L.L. wW-167,Alimentos
42,Fábrica Fuertes S.L.N.E tI-193,Alimentos
43,Banco CKBQ S.L.N.E TM-342,Ropa
44,Inversiones Crespo S.A. DV-959,Ropa
45,Comercial Españolas S.A. Em-852,Hogar
46,Compañía Bonet y asociados S.L. fv-133,Deportes
47,Pareja & Asociados S.L.L. cm-153,Hogar
48,Hermanos Martin S.A. QT-781,Electrónica
49,Comercial ZMSC S.L. AV-557,Electrónica
50,Gámez y Mayoral S.Com. Vl-418,Deportes
51,Despacho WSF S.Com. Rf-064,Deportes
52,Banca Privada YVM S.L.U. bd-691,Hogar
53,Distribuciones Ibáñez S.A. jA-168,Alimentos
54,Despacho Blanes S.L. kP-756,Alimentos
55,Pizarro y Coll S.A. KZ-347,Deportes
56,Alimentación RL S.L. Wi-572,Hogar
57,Augusto Fortuny Cruz S.A. Jv-074,Ropa
58,Macaria Castells Izquierdo S.L. jN-871,Ropa
59,Borja y asociados S.Com. ZP-058,Deportes
60,Grupo Villalobos S.Com. Jb-604,Hogar
61,Farmaceútica Juárez S.A. qC-547,Alimentos
62,Nogueira y Arnaiz S.L. OG-041,Deportes
63,Ruano y asociados S.L.N.E gy-430,Deportes
64,Pablo y asociados S.L.L. FH-388,Electrónica
65,Luisa Piquer Olivera S.Com. en-993,Ropa
66,Badía y Riera S.L. fg-290,Hogar
67,Restauración Avanzadas S.L.N.E QW-794,Deportes
68,Vanesa Bernal Alcántara S.A.T. hW-035,Ropa
69,Logística Hoyos & Asociados S.L.N.E eL-944,Electrónica
70,Infraestructuras QMX S.A.U pL-728,Hogar
71,Buendía y asociados S.Coop. Uo-095,Hogar
72,Servicios Uriarte S.A. WH-848,Ropa
73,Álvaro y Riba S.L.L. Lk-562,Alimentos
74,Estevez & Asociados S.Coop. WW-280,Deportes
75,Fábrica MK S.Com. BI-885,Hogar
76,Suministros Toro y asociados S.L. zr-809,Hogar
77,Gilabert y asociados S.L.N.E KE-495,Ropa
78,Collado & Asociados S.A.T. uw-317,Hogar
79,Cuadrado y asociados S.C.P Re-741,Electrónica
80,Restauración Crespi y asociados S.Com. NF-119,Ropa
81,Jimenez y Nadal S.A.T. Yu-965,Ropa
82,Minería WUFW S.Coop. Kn-300,Deportes
83,Varela & Asociados S.A. cf-163,Deportes
84,Talavera & Asociados S.A. Hr-422,Electrónica
85,Inversiones Iberia S.Coop. KO-680,Deportes
86,Suministros Avilés & Asociados S.L. aY-804,Alimentos
87,Finanzas Inteligentes S.Coop. CV-153,Deportes
88,Promociones del Mediterráneo S.Com. uq-715,Alimentos
89,Soluciones Alcázar y asociados S.A.U NB-260,Alimentos
90,Roberta Lastra Quintana S.L. dO-272,Ropa
91,Fábregas y asociados S.L.N.E eg-499,Alimentos
92,Minería Rebollo S.Com. Vc-285,Deportes
93,Compañía Palau S.L.N.E bR-383,Electrónica
94,Wilfredo Nieto Montero S.Coop. lA-126,Ropa
95,Fábrica Peláez y asociados S.Coop. Vz-844,Electrónica
96,Hnos Alonso S.L.L. SK-519,Deportes
97,Comercializadora ZTH S.L. Yt-441,Deportes
98,Manufacturas Fuster S.L. Il-649,Hogar
99,Manufacturas del Sur S.C.P yX-765,Deportes
100,Arco y asociados S.A. qP-549,Hogar
101,Inversiones Ibéricos S.L.U. QF-687,Hogar
102,Manufacturas PJH S.A. dF-949,Hogar
103,Hernando y Martín S.L.N.E LD-535,Alimentos
104,Edelmiro Azcona Asenjo S.A. Do-547,Electrónica
105,Infraestructuras Hernandez & Asociados S.L.L. il-487,Ropa
106,Pavón y asociados S.L.N.E go-564,Ropa
107,León y asociados S.Com. Px-685,Deportes
108,Iker Miralles Cordero S.A.U xw-285,Alimentos
109,Hermanos Torre S.L. Gg-475,Deportes
110,Quevedo y Arregui S.A. Xm-841,Hogar
111,Diez y Gómez S.A.T. tb-470,Ropa
112,Cristian Infante Pérez S.L.L. UF-714,Alimentos
113,Lola Higueras Manso S.A. vc-559,Alimentos
114,Transportes Inteligentes S.Com. Db-601,Deportes
115,Restauración Españolas S.A. Rb-759,Electrónica
116,Familia Ríos S.L. YP-679,Alimentos
117,Banco Torrijos y asociados S.L. uR-285,Hogar
118,Servicios IMSQ S.A.U Cz-896,Ropa
119,Minería Ibérica S.L. RY-735,Ropa
120,Águila y asociados S.A. iI-072,Alimentos
121,Inmobiliaria Española S.L.N.E Wm-351,Electrónica
122,Familia Lladó S.A. kF-974,Hogar
123,Hotel Rosell y asociados S.L.L. TX-357,Hogar
124,Sala y Barros S.L.N.E mT-480,Hogar
125,Familia Sastre S.L. xJ-356,Electrónica
126,Restauración Amaya S.Coop. pU-526,Alimentos
127,Nélida Lamas Bayo S.A. BL-886,Ropa
128,Compañía IX S.L. OQ-214,Deportes
129,Logística Cuenca S.L. FY-119,Hogar
130,Manufacturas Maza S.Com. OO-574,Electrónica
131,Restauración Perales & Asociados S.A. eh-544,Electrónica
132,Manufacturas LV S.A. dn-052,Deportes
133,Fábrica RLA S.L. fq-847,Electrónica
134,Cañizares y Daza S.A. pm-148,Deportes
135,Logística Integrales S.L.N.E Ck-112,Hogar
136,Restauración Avanzadas S.A. sD-876,Ropa
137,Arturo Alarcón Robles S.L. Ip-761,Hogar
138,René Cobos Perea S.A. OA-671,Hogar
139,Construcción Valenzuela S.A. Hz-488,Ropa
140,Hermanos Calderon S.Coop. oQ-930,Ropa
141,Restauración Martorell S.L. BD-649,Alimentos
142,Construcción Blanco y asociados S.A. yY-390,Deportes
143,Banco Torrecilla & Asociados S.A.T. TM-251,Electrónica
144,Isabela Baena Casal S.Coop. gm-589,Deportes
145,Cisneros y Posada S.Coop. lh-074,Deportes
146,Huerta & Asociados S.Coop. kz-625,Ropa
147,Grupo Dávila S.A. TG-908,Alimentos
148,Quique Llorente Vilar S.A. Xx-933,Hogar
149,Inversiones Ibérica S.L. Ax-910,Deportes
150,Jose Morera Blasco S.Coop. Kn-546,Alimentos
151,Carvajal & Asociados S.L.N.E ZW-140,Alimentos
152,Despacho MERA S.L. ao-799,Alimentos
153,Santiago & Asociados S.Coop. Sb-717,Electrónica
154,Banco del Levante S.Com. te-709,Ropa
155,Infraestructuras Piña S.A. IZ-164,Deportes
156,Logística Ibérica S.A.U hW-684,Ropa
157,María Cristina Quintanilla Sebastián S.Coop. yr-600,Deportes
158,Inversiones Internacionales S.L.N.E fO-973,Hogar
159,Martirio Guzmán Arribas S.A.T. YA-249,Hogar
160,Nazario Valero Laguna S.L.U. tI-510,Alimentos
161,Banco Mateos y asociados S.L. fw-318,Hogar
162,Aller y Nogueira S.L.L. DM-270,Deportes
163,Martínez y asociados S.Com. dE-111,Hogar
164,Ruben Melero Sancho S.Com. Dj-565,Alimentos
165,Evaristo Delgado Ponce S.L. vr-348,Alimentos
166,Grupo Alarcón S.Coop. wV-468,Electrónica
167,Alberdi y Roura S.Com. PT-992,Deportes
168,Bauzà y Gil S.Coop. cN-687,Hogar
169,Sol Saez Sastre S.Com. WP-570,Ropa
170,Soluciones Globales S.Com. lV-779,Ropa
171,Buenaventura Blázquez Ballesteros S.L.N.E iJ-351,Deportes
172,Duque y Exposito S.L. Pk-068,Hogar
173,Finanzas Céspedes & Asociados S.A. nN-302,Hogar
174,Infraestructuras Integrales S.Com. Kq-606,Ropa
175,Alimentación del Mediterráneo S.Coop. CI-235,Electrónica
176,Moraleda y Checa S.Coop. vp-128,Hogar
177,Ligia Atienza Aparicio S.L. Jv-448,Electrónica
178,Tecnologías Niño & Asociados S.A. qk-980,Alimentos
179,Olmo y asociados S.L.N.E pC-805,Deportes
180,Mate y Catalán S.Com. BJ-078,Alimentos
181,Candelas Puente Amorós S.L. ik-039,Deportes
182,Industrias VB S.L.N.E zA-958,Deportes
183,Desarrollo del Sur S.Coop. Fm-728,Electrónica
184,Infraestructuras PD S.L. EQ-291,Alimentos
185,Menendez y Mas S.A. Wl-033,Alimentos
186,Hnos Acuña S.A. HF-102,Hogar
187,Manufacturas Bernad & Asociados S.L.N.E fU-220,Electrónica
188,Poncio Martorell Pazos S.L.N.E HF-164,Hogar
189,Comercializadora Baquero S.L.N.E iD-466,Hogar
190,Alemán & Asociados S.Com. qr-697,Alimentos
191,Comercial Gras S.L.N.E IX-607,Ropa
192,Manzano & Asociados S.A.D Fj-958,Hogar
193,Fábrica del Mediterráneo S.Coop. Yf-060,Deportes
194,Manufacturas Salinas & Asociados S.A.T. rV-671,Ropa
195,Vall & Asociados S.Coop. xc-701,Hogar
196,Suministros FSZ S.A. eK-925,Deportes
197,Banco Carreras S.L.L. ip-285,Ropa
198,Despacho del Norte S.L.L. WE-493,Electrónica
199,Vega & Asociados S.Coop. Ox-158,Alimentos
200,Casanovas & Asociados S.Com. fs-397,Electrónica
201,Banca Privada Soler S.Com. Yt-741,Ropa
202,Inversiones Solsona S.L.L. yi-962,Hogar
203,Bernal & Asociados S.L. YE-249,Deportes
204,Jonatan Rovira Serra S.Coop. Ot-443,Ropa
205,Manufacturas Inteligentes S.L. kM-787,Deportes
206,Paredes y Tamayo S.A. HR-643,Electrónica
207,Grupo Arévalo S.L. Pb-348,Electrónica
208,Desarrollo Marcos y asociados S.Coop. Ud-600,Deportes
209,Alimentación Bastida y asociados S.L. Ai-737,Deportes
210,Distribuciones Ramirez y asociados S.L. qM-225,Ropa
211,Banco Giner S.Com. MW-930,Electrónica
212,Inmobiliaria YVJH S.A.U lz-172,Hogar
213,Comercializadora Jordán y asociados S.L.N.E Ya-569,Ropa
214,Familia Vélez S.C.P vN-933,Electrónica
215,Supermercados Medina & Asociados S.A. NA-835,Hogar
216,Teruel y Tapia S.L. Mb-153,Electrónica
217,Distribuciones Rosado S.L. UX-247,Hogar
218,Servicios Internacionales S.A. Kb-329,Deportes
219,Familia Rosell S.Com. Pt-761,Deportes
220,Despacho Sanmiguel y asociados S.C.P Qd-554,Deportes
221,Farmaceútica Ibarra & Asociados S.Com. UT-792,Deportes
222,Hnos Salazar S.L.N.E Nm-493,Electrónica
223,Hotel Páez & Asociados S.C.P YS-392,Deportes
224,Díaz y asociados S.Coop. mp-357,Deportes
225,Hotel BZ S.C.P lo-330,Deportes
226,Menéndez y Cadenas S.L.L. qb-247,Hogar
227,Farré y asociados S.A. cu-335,Electrónica
228,Servicios GQ S.Com. xw-071,Hogar
229,Valenzuela & Asociados S.L. jj-404,Hogar
230,Manufacturas Pozuelo y asociados S.A. xx-992,Deportes
231,Desarrollo MPB S.Coop. fp-819,Electrónica
232,Almazán y asociados S.L. qW-349,Deportes
233,Tecnologías RZ S.L. zB-571,Ropa
234,Farmaceútica Globales S.L.U. YB-630,Hogar
235,Soluciones RD S.L. pu-856,Hogar
236,Alimentación Abascal S.Coop. sj-150,Deportes
237,Hermanos Pol S.Coop. CD-569,Ropa
238,Inversiones JK S.Com. cg-809,Deportes
239,Familia Luís S.L. Un-610,Electrónica
240,Transportes Vilanova S.Coop. Mn-818,Alimentos
241,Hermanos Portillo S.L. Hh-638,Hogar
242,Verdejo y Suárez S.L. Rw-518,Ropa
243,Arroyo y Ordóñez S.L. zW-965,Deportes
244,Restauración Tejero S.A. jT-007,Alimentos
245,Faustino Abellán Caparrós S.L. Om-472,Electrónica
246,Humberto Ortiz Rivera S.C.P UU-783,Electrónica
247,Grupo Ayala S.L. WM-978,Ropa
248,Calderón y asociados S.Com. nA-498,Hogar
249,Tecla Bernad Juan S.Com. By-490,Alimentos
250,Sancho y Peralta S.A. gf-857,Hogar
251,Mayo y Pablo S.Com. zn-595,Alimentos
252,Industrias Borrás & Asociados S.L.N.E jb-739,Alimentos
253,Grupo Olmedo S.Coop. WY-565,Deportes
254,Industrias del Sur S.L. Rm-730,Deportes
255,Restauración JZE S.A. sJ-615,Ropa
256,Ignacia Corral Alberola S.L.L. ix-240,Hogar
257,Manufacturas Montesinos & Asociados S.L. cG-549,Deportes
258,Grupo Valcárcel S.Com. GE-738,Ropa
259,Inversiones Pina S.A. ZY-303,Electrónica
260,Industrias Zorrilla & Asociados S.L. Lf-000,Hogar
261,Hotel Milla & Asociados S.Coop. FS-930,Hogar
262,Construcción Río y asociados S.Com. jG-466,Deportes
263,Jimena Ferreras Palomar S.A. jv-962,Deportes
264,Supermercados Morán S.L. ip-002,Hogar
265,Grupo Gomez S.L.N.E yV-405,Ropa
266,Vito Calatayud Espinosa S.Com. Vc-589,Alimentos
267,Construcción Villalonga & Asociados S.L. eA-805,Hogar
268,Rosado y Aroca S.L. Li-123,Hogar
269,Belen Marin Llorens S.Coop. Jy-909,Deportes
270,Soluciones Española S.Com. uJ-769,Ropa
271,Inversiones Mateo & Asociados S.A. jq-248,Alimentos
272,Feijoo y Bejarano S.A.U et-737,Alimentos
273,Arnaiz & Asociados S.L.N.E Sj-180,Alimentos
274,Pintor y Carro S.L.N.E QK-193,Electrónica
275,Agudo y Piñol S.A. GK-471,Ropa
276,Construcción PGMS S.Com. UF-924,Electrónica
277,Galván y Mancebo S.A. fr-034,Hogar
278,Finanzas AF S.L.L. av-814,Deportes
279,Hotel QG S.L.N.E Cc-044,Electrónica
280,Ribas & Asociados S.Coop. Dg-406,Hogar
281,Talleres Zurita & Asociados S.A. ZZ-314,Alimentos
282,Porta y asociados S.Com. uQ-227,Deportes
283,Eli Leiva Ballester S.Coop. nC-403,Hogar
284,Infraestructuras Zapata y asociados S.A. gT-339,Alimentos
285,Servicios Inteligentes S.A. ay-641,Hogar
286,Grupo Diez S.Com. eS-753,Hogar
287,Hermanos Torrijos S.L.N.E Rc-631,Ropa
288,Banca Privada FHPO S.A. ys-360,Alimentos
289,Familia Lucas S.Com. Mt-867,Alimentos
290,Villena y Llabrés S.Coop. aP-817,Ropa
291,Servicios Españolas S.A. aW-077,Hogar
292,Supermercados XNL S.Coop. mZ-949,Electrónica
293,Banco del Norte S.Coop. gK-117,Deportes
294,Azorin y Arce S.C.P rs-021,Hogar
295,Compañía Palacios y asociados S.L.L. oo-674,Hogar
296,Inversiones del Noroeste S.L.U. oK-552,Ropa
297,Tecnologías BKMM S.A. SZ-049,Electrónica
298,Restauración Quintero S.L.U. VN-361,Deportes
299,Flora Sastre Gutiérrez S.A. tW-739,Ropa
300,Cortes y Llano S.Coop. wH-238,Deportes
301,Mur y Hervia S.L.L. JD-276,Deportes
302,Infraestructuras EWMD S.L. Cc-796,Ropa
303,Aguado y Pavón S.Com. uD-173,Hogar
304,Consultoría Carrión S.Com. SZ-506,Electrónica
305,Promociones Integrales S.Com. IS-639,Hogar
306,Albino Cal Marti S.L. ao-557,Hogar
307,Infraestructuras Globales S.Coop. zV-186,Electrónica
308,Promociones Montserrat S.A. Nl-050,Ropa
309,Baeza y Aguilar S.A. fu-110,Deportes
310,Benavent y Ribes S.A. Jq-973,Hogar
311,Compañía Chaparro & Asociados S.L.L. Gi-008,Deportes
312,Inversiones del Mediterráneo S.L.L. zE-908,Ropa
313,Finanzas Gibert S.A. hF-448,Alimentos
314,Eusebia Hierro Rey S.L.L. eM-556,Hogar
315,Desarrollo Bello S.L. ib-882,Ropa
316,Garcés y Bilbao S.Coop. Ey-641,Alimentos
317,Hotel IV S.L. BG-693,Ropa
318,Logística Española S.Com. ap-764,Alimentos
319,Hotel Bauzà S.L. iY-325,Electrónica
320,Servicios Santos S.L.N.E pD-269,Hogar
321,Logística Dalmau & Asociados S.Com. qt-964,Alimentos
322,Industrias Román y asociados S.Coop. Yo-114,Hogar
323,Banco del Noroeste S.C.P uJ-980,Alimentos
324,Alejandra Blázquez Múgica S.Com. XO-590,Electrónica
325,Diaz y Tirado S.Coop. wK-902,Electrónica
326,Despacho LN S.Com. hA-372,Hogar
327,Servicios Prats S.L. uG-323,Ropa
328,Comercializadora Agudo & Asociados S.L. KF-599,Deportes
329,María Luisa Gordillo Sarabia S.L.N.E wF-939,Hogar
330,Olivares & Asociados S.Coop. rR-247,Deportes
331,Comercializadora YL S.Com. TH-703,Hogar
332,Colomer y Padilla S.Com. gk-761,Ropa
333,Manzanares & Asociados S.A.D cx-008,Deportes
334,Ibañez y Antón S.L. kO-829,Ropa
335,Desarrollo Vidal y asociados S.A.T. ER-210,Deportes
336,Compañía Iberia S.L. Ws-365,Electrónica
337,Company & Asociados S.A. NC-201,Electrónica
338,Hermanos Cervera S.Coop. RT-416,Deportes
339,Transportes Ropero S.L. ek-365,Hogar
340,Osuna y asociados S.A. fc-005,Hogar
341,Inversiones BNGW S.A. Aa-003,Ropa
342,Eloy Castelló Hernandez S.Com. aT-283,Electrónica
343,Inmobiliaria Globales S.L.N.E vZ-437,Ropa
344,Consultoría del Noroeste S.L. Mh-280,Deportes
345,Prieto y Giner S.A. JE-696,Deportes
346,Alimentación Ibarra & Asociados S.L.L. qe-454,Ropa
347,Hnos Cabezas S.Com. ab-497,Ropa
348,Instalaciones Muñoz & Asociados S.A. tj-176,Electrónica
349,Domínguez y Villalobos S.A. hw-241,Ropa
350,Hermanos Alfaro S.L. TA-699,Ropa
351,Finanzas RI S.Com. iQ-232,Ropa
352,Hermanos Vaquero S.L.L. Ot-377,Hogar
353,Minería Integrales S.L. lv-476,Electrónica
354,Promociones Castellana S.L. Xk-115,Alimentos
355,Montenegro y asociados S.L.L. JI-778,Ropa
356,Servicios Arjona S.A.T. Lb-748,Deportes
357,Banca Privada Integrales S.L.N.E aT-588,Deportes
358,Desiderio Rosales Bauzà S.L. Mo-422,Hogar
359,Moya y asociados S.L. cu-592,Deportes
360,Ramírez y asociados S.Com. fg-799,Alimentos
361,Supermercados Ibéricos S.A. Aj-457,Alimentos
362,Sandra Ibáñez Morcillo S.L. aJ-116,Deportes
363,Sobrino & Asociados S.L. lh-152,Hogar
364,Finanzas del Mediterráneo S.L. aG-960,Electrónica
365,Inmobiliaria del Norte S.Com. OK-128,Hogar
366,Alimentación del Sur S.C.P UK-113,Hogar
367,Crescencia Castañeda Soler S.A. Yo-560,Electrónica
368,Transportes del Levante S.L.N.E UP-285,Alimentos
369,Vila y Calvo S.Coop. Dz-439,Hogar
370,Comercial Avanzadas S.L. Ls-737,Deportes
371,Inmobiliaria Milla y asociados S.L. hc-444,Electrónica
372,Samuel Domínguez Rojas S.A. tX-543,Hogar
373,Paulina Pacheco Canales S.L. vL-043,Deportes
374,Manufacturas Castellana S.Coop. xG-996,Alimentos
375,Sanjuan & Asociados S.L.N.E QZ-756,Hogar
376,Restauración BZL S.Com. dC-073,Electrónica
377,Talleres XEV S.L. PO-350,Hogar
378,Hnos Verdejo S.Coop. jm-692,Alimentos
379,Logística Inteligentes S.A. LM-369,Deportes
380,Castillo y asociados S.L. fW-023,Ropa
381,Servicios Miró S.A. SQ-735,Deportes
382,Carrera y asociados S.L. Sd-249,Ropa
383,Desarrollo Globales S.A.U sB-771,Deportes
384,Aragonés & Asociados S.L. SC-555,Alimentos
385,Grupo Arco S.A. em-174,Deportes
386,Mendoza y Lara S.L.N.E ZE-594,Electrónica
387,Cantero y Cuesta S.A. fO-939,Deportes
388,Tecnologías Alcaraz S.L.L. Vz-507,Hogar
389,Despacho TV S.Coop. ys-305,Hogar
390,Soluciones Osorio & Asociados S.L. uZ-455,Electrónica
391,Méndez & Asociados S.A. Ba-635,Electrónica
392,Andrea Torrens Mesa S.L.N.E FA-332,Ropa
393,Comercial Integrales S.L. Hl-600,Deportes
394,Servicios del Mediterráneo S.L. bl-269,Hogar
395,Despacho Barrios S.Coop. zg-550,Hogar
396,María Teresa Arcos Rosales S.L. vR-701,Alimentos
397,Farmaceútica CE S.A.D DB-490,Hogar
398,Tere Céspedes Carbó S.Com. Rp-183,Alimentos
399,Comercializadora Iberia S.Coop. ha-692,Deportes
400,Gomez & Asociados S.Coop. cd-226,Electrónica
401,Despacho Vicente S.A.U lD-774,Alimentos
402,Hermanos Macias S.Coop. IC-578,Hogar
403,Despacho Barrios S.Com. SV-228,Ropa
404,Familia Diego S.Com. sq-980,Deportes
405,Rius y Pavón S.Coop. FA-524,Hogar
406,Hnos Aliaga S.L. SO-472,Ropa
407,Manufacturas Elorza y asociados S.Coop. Sq-787,Hogar
408,Ana Belén Julián Alcalá S.Com. uE-946,Alimentos
409,Álvaro Baena Roura S.A. MD-988,Electrónica
410,Inversiones Cortina S.Com. GY-092,Electrónica
411,Servicios Belda S.L. Cb-641,Deportes
412,Hermanos Ferrández S.L.N.E cv-186,Hogar
413,Puga y Villalba S.A. yt-316,Hogar
414,Ruth Pedro Baró S.A. hl-983,Hogar
415,Desarrollo Paniagua & Asociados S.L.U. Yb-416,Deportes
416,Compañía CNBW S.L.N.E SG-170,Deportes
417,Torre y Calderon S.Com. Pg-077,Ropa
418,Hnos Machado S.A. JL-336,Ropa
419,Salas y asociados S.Coop. fQ-246,Hogar
420,Hermanos Bautista S.A. RE-900,Hogar
421,Familia Valderrama S.Coop. ax-502,Deportes
422,Grupo Oliveras S.L. RW-972,Electrónica
423,Farmaceútica Castellana S.A. xN-297,Alimentos
424,Julio César Serna Múgica S.L. MV-965,Alimentos
425,Marianela Mendoza Iñiguez S.L.L. yQ-252,Hogar
426,Distribuciones Barbero y asociados S.A. XU-415,Hogar
427,Supermercados Inteligentes S.A. pD-513,Ropa
428,Supermercados del Noroeste S.L. Cy-699,Alimentos
429,Restauración RQ S.Coop. MQ-174,Electrónica
430,Hermanos Viñas S.Com. fr-688,Electrónica
431,Banco Villalba & Asociados S.A.T. ks-586,Electrónica
432,Hermanos Saldaña S.C.P NK-509,Ropa
433,Gallart y España S.C.P CV-352,Alimentos
434,Construcción EY S.L.N.E Iq-851,Deportes
435,Rodrigo y Vidal S.Coop. ke-593,Electrónica
436,Minería del Noroeste S.A. US-307,Deportes
437,Inmobiliaria Avanzadas S.L.N.E QA-022,Deportes
438,Despacho Oliva y asociados S.L. vs-205,Ropa
439,Tecnologías Cal S.L. ER-214,Hogar
440,Inmobiliaria Salvador y asociados S.Com. pD-429,Electrónica
441,Tecnologías CNYP S.A. Dl-461,Alimentos
442,Nicodemo Asenjo Linares S.Com. BC-292,Deportes
443,Vara y Villegas S.L. HD-798,Electrónica
444,Natalio Marcos Lopez S.Com. ep-474,Electrónica
445,Alimentación Carlos & Asociados S.L. aS-936,Hogar
446,Royo & Asociados S.L. nq-519,Ropa
447,Ibañez y Villalobos S.Coop. Hs-124,Deportes
448,Tecnologías Herrera y asociados S.L. ex-561,Electrónica
449,Quesada y Cerdán S.L. bQ-307,Electrónica
450,Naranjo y Iniesta S.Coop. yc-531,Deportes
451,Desarrollo Sancho S.L. dn-433,Electrónica
452,Imelda Echeverría Téllez S.A. tD-624,Hogar
453,Ripoll & Asociados S.L.L. nI-121,Electrónica
454,Hnos Estevez S.Coop. zA-780,Ropa
455,Logística TSSR S.Com. uT-356,Deportes
456,Compañía Yáñez & Asociados S.A. vi-882,Electrónica
457,Distribuciones BCWC S.L.N.E LT-946,Hogar
458,Farmaceútica Valls & Asociados S.L.U. cv-847,Ropa
459,Banco Herrera S.A. IJ-329,Alimentos
460,Ciriaco Diez Gallego S.L. yH-036,Alimentos
461,Marcos y Castañeda S.L. iB-786,Electrónica
462,Estrada y asociados S.A. Up-760,Ropa
463,Alimentación Vega S.L.U. or-778,Alimentos
464,Cebrián Aguilar Ramos S.A. rO-833,Electrónica
465,Pedrosa y asociados S.A.U Pi-623,Ropa
466,Angelina Arce Barba S.C.P wT-358,Alimentos
467,Isaías Barrera Casas S.L. Jw-322,Electrónica
468,Ágata Alsina Miguel S.L. vv-402,Alimentos
469,Manrique y asociados S.Coop. DP-397,Deportes
470,Hermanos Calvet S.A. ex-788,Ropa
471,Machado y Pulido S.L.N.E zY-738,Ropa
472,Pinto & Asociados S.Com. VQ-484,Alimentos
473,Valera y Gracia S.A.D Sk-291,Deportes
474,Manufacturas Ortuño y asociados S.L.N.E QB-700,Electrónica
475,Industrias Juárez S.L.N.E kA-994,Alimentos
476,Banco Torrents y asociados S.A. nd-895,Alimentos
477,Desarrollo CSMA S.L. fW-387,Alimentos
478,Cobo y Goicoechea S.C.P du-689,Electrónica
479,Banco JXTL S.Coop. Db-356,Ropa
480,Supermercados Tudela S.A. yx-715,Deportes
481,Pedro y Sevillano S.L. Fv-945,Hogar
482,Peláez y asociados S.A. SO-553,Electrónica
483,Cañete y Blanch S.Com. se-485,Ropa
484,Minería Iberia S.L. Zd-252,Ropa
485,Tere Ávila Valle S.A. ge-165,Deportes
486,Compañía Marí S.L.L. Ts-574,Electrónica
487,Company & Asociados S.L. Oy-027,Deportes
488,Talleres Francisco & Asociados S.Coop. dm-824,Alimentos
489,Herranz & Asociados S.L. sa-124,Ropa
490,Finanzas Rubio S.A.U fl-094,Electrónica
491,Banco LIS S.Coop. Tb-990,Electrónica
492,Tecnologías Iriarte & Asociados S.A. tA-325,Deportes
493,Familia Bonet S.L.N.E VU-134,Deportes
494,Infraestructuras del Levante S.Coop. XR-339,Electrónica
495,Echeverría y Serrano S.Com. Fp-612,Alimentos
496,Desarrollo Carmona & Asociados S.A. ST-291,Hogar
497,Compañía Ibéricos S.A. Jc-494,Deportes
498,Comercial Álvarez S.L. tZ-966,Alimentos
499,Cruz & Asociados S.A. Lc-919,Hogar
500,Comercializadora Gaya S.A. gC-683,Ropa
